{
  "schema_version": "stackkits-webmcp/v1",
  "source_sha": "4060d75673ef5958a86374bdbf40fbfebacb0959",
  "authority_bundle_sha256": "f1f3622cb9e0e59f8ab3800084bcca270ddf9ad06ab843e3885193e8e7f46122",
  "kits": [
    {
      "stackkit_id": "basement-kit",
      "display_name": "Basement Kit",
      "version": "5.1.0",
      "description": "Local-first StackKit for one or more nodes on private home sites",
      "status": "supported",
      "planner_link": "/planner?stackkit_id=basement-kit",
      "compute_tiers": [
        "low",
        "standard",
        "high"
      ],
      "tiers": {
        "low": {
          "compute_tier": "low",
          "host_requirements": {
            "min_cpu_cores": 2,
            "min_ram_gb": 2,
            "min_storage_gb": 10,
            "recommended_cpu_cores": 2,
            "recommended_ram_gb": 2,
            "recommended_storage_gb": 10
          },
          "platform_management": "standalone",
          "enable_capabilities": [],
          "module_substitutions": {
            "stackkits-basement-core-runtime": "stackkits-basement-core-lite-runtime",
            "stackkits-immich-runtime": "stackkits-immich-lite-runtime"
          },
          "module_runtime_requirements": [
            {
              "module_id": "stackkits-basement-core-lite-runtime",
              "declaration": "declared",
              "runtime_requirements": {
                "min_cpu_cores": 2,
                "min_ram_gb": 2,
                "min_storage_gb": 10
              }
            },
            {
              "module_id": "stackkits-cloudreve-runtime",
              "declaration": "not_declared"
            },
            {
              "module_id": "stackkits-home-assistant-runtime",
              "declaration": "not_declared"
            },
            {
              "module_id": "stackkits-immich-lite-runtime",
              "declaration": "not_declared"
            },
            {
              "module_id": "stackkits-vaultwarden-runtime",
              "declaration": "not_declared"
            }
          ],
          "use_case_fits": [
            {
              "use_case_id": "ai",
              "title": "Private AI",
              "included": false,
              "reason": "CPU inference needs the explicit standard hardware floor."
            },
            {
              "use_case_id": "dev",
              "title": "Developer Platform",
              "included": false,
              "reason": "The first Git hosting path uses the standard profile."
            },
            {
              "use_case_id": "documents",
              "title": "Documents",
              "included": false,
              "reason": "The first Paperless-ngx path uses the standard profile."
            },
            {
              "use_case_id": "files",
              "title": "File Storage and Documents",
              "included": true,
              "functions": [
                "document-storage",
                "file-sharing",
                "files"
              ],
              "load": {
                "residency": "always-on",
                "baseline": "idle-resident",
                "burst": "interactive"
              },
              "module_slug": "cloudreve",
              "notes": [
                "Lightweight sharing. Nextcloud is not a native workload on any profile."
              ]
            },
            {
              "use_case_id": "game",
              "title": "Game Server",
              "included": false,
              "reason": "Post-1.0. Game servers are on-demand session load, not a low-graph resident."
            },
            {
              "use_case_id": "mail",
              "title": "Private Mail",
              "included": false,
              "reason": "Mail is post-1.0. A mail stack is always-on active-resident (SMTP/IMAP) and does not fit low until a lite contract exists."
            },
            {
              "use_case_id": "media",
              "title": "Media Library",
              "included": false,
              "reason": "Jellyfin library + transcode is not on the Basement low graph. Needs a lite substitution before it can be included."
            },
            {
              "use_case_id": "photos",
              "title": "Photos and Memories",
              "included": true,
              "functions": [
                "media-backup",
                "photo-management",
                "photos"
              ],
              "load": {
                "residency": "always-on",
                "baseline": "idle-resident",
                "burst": "ingest"
              },
              "module_slug": "immich-lite",
              "notes": [
                "No ML search. Catalog alternative immich-lite on standalone-compose. Kit graph also substitutes stackkits-immich-lite-runtime. Mobile backup is the spike; the library otherwise waits."
              ]
            },
            {
              "use_case_id": "remote",
              "title": "Remote Desktop",
              "included": false,
              "reason": "Guacamole is SK-M5 and not on the low graph."
            },
            {
              "use_case_id": "smart-home",
              "title": "Smart Home",
              "included": true,
              "functions": [
                "automation",
                "smart-home-hub"
              ],
              "load": {
                "residency": "always-on",
                "baseline": "active-resident",
                "burst": "interactive"
              },
              "module_slug": "home-assistant",
              "notes": [
                "24/7 radio/state loop is the base load. Classic constrained-device resident. Native MCP and extra bridges stay optional."
              ]
            },
            {
              "use_case_id": "vault",
              "title": "Password Vault",
              "included": true,
              "functions": [
                "password-manager",
                "secure-notes",
                "totp"
              ],
              "load": {
                "residency": "always-on",
                "baseline": "idle-resident",
                "burst": "interactive"
              },
              "module_slug": "vaultwarden",
              "notes": [
                "Always resident for unlock/sync; almost no idle CPU. Fits the low graph."
              ]
            }
          ]
        },
        "standard": {
          "compute_tier": "standard",
          "host_requirements": {
            "min_cpu_cores": 2,
            "min_ram_gb": 4,
            "min_storage_gb": 20,
            "recommended_cpu_cores": 4,
            "recommended_ram_gb": 4,
            "recommended_storage_gb": 20
          },
          "platform_management": "selected-provider",
          "enable_capabilities": [],
          "module_substitutions": {},
          "module_runtime_requirements": [
            {
              "module_id": "stackkits-basement-core-lite-runtime",
              "declaration": "declared",
              "runtime_requirements": {
                "min_cpu_cores": 2,
                "min_ram_gb": 2,
                "min_storage_gb": 10
              }
            },
            {
              "module_id": "stackkits-cloudreve-runtime",
              "declaration": "not_declared"
            },
            {
              "module_id": "stackkits-gitea-runtime",
              "declaration": "not_declared"
            },
            {
              "module_id": "stackkits-home-assistant-runtime",
              "declaration": "not_declared"
            },
            {
              "module_id": "stackkits-immich-runtime",
              "declaration": "not_declared"
            },
            {
              "module_id": "stackkits-jellyfin-runtime",
              "declaration": "not_declared"
            },
            {
              "module_id": "stackkits-paperless-runtime",
              "declaration": "not_declared"
            },
            {
              "module_id": "stackkits-private-ai-runtime",
              "declaration": "not_declared"
            },
            {
              "module_id": "stackkits-vaultwarden-runtime",
              "declaration": "not_declared"
            }
          ],
          "use_case_fits": [
            {
              "use_case_id": "ai",
              "title": "Private AI",
              "included": true,
              "functions": [
                "chat-interface",
                "local-inference",
                "model-serving"
              ],
              "load": {
                "residency": "always-on",
                "baseline": "idle-resident",
                "burst": "interactive"
              },
              "module_slug": "ollama",
              "notes": [
                "No model is installed automatically. Model weights and context determine additional RAM and disk."
              ]
            },
            {
              "use_case_id": "dev",
              "title": "Developer Platform",
              "included": true,
              "functions": [
                "developer-collaboration",
                "git-hosting",
                "source-control"
              ],
              "load": {
                "residency": "always-on",
                "baseline": "idle-resident",
                "burst": "interactive"
              },
              "module_slug": "gitea",
              "notes": [
                "Repository growth requires a separate disk budget. No CI runner is included."
              ]
            },
            {
              "use_case_id": "documents",
              "title": "Documents",
              "included": true,
              "functions": [
                "document-ingestion",
                "document-management",
                "document-search",
                "ocr"
              ],
              "load": {
                "residency": "always-on",